{
  "schema_version": "city-airport-market-config-v1",
  "config_version": "wuxi-sunan-airport-system-v2",
  "market": {
    "city_airport_market_id": "wuxi_sunan_airport_system",
    "city_name": "无锡/苏州",
    "region_id": "china_mainland",
    "region_name": "中国大陆",
    "market_tier": "secondary_gateway",
    "market_type": "primary_single_airport_near_large_hubs",
    "airport_system": "苏南硕放"
  },
  "upstream_linkage": {
    "regional_aviation_demand_region_id": "china_mainland",
    "regional_air_capacity_supply_region_id": "china_mainland",
    "seed_mode": "inherit",
    "branch_mode": "inherit",
    "passenger_components": ["business", "leisure", "vfr", "long_haul", "transfer"]
  },
  "demand_model": {
    "baseline_year": 2025,
    "baseline_region_demand_share_pct": 1.55,
    "baseline_city_potential_passengers_million": 12.5,
    "annual_long_term_city_growth_bias_pct": 0.56,
    "max_long_term_city_growth_bias_pct": 32.0,
    "target_long_term_potential_range_million": [38.0, 75.0],
    "seed_potential_model": {
      "enabled": true,
      "template_id": "china_yangtze_delta_port_manufacturing_challenger_seed_potential_v1",
      "release_start_year_index": 4.0,
      "full_effect_year_index": 29.0,
      "annual_growth_bias_range_pct": [-0.5, 0.72],
      "max_growth_bias_range_pct": [-23.0, 38.0],
      "regional_correlation_weight": 0.3,
      "potential_multiplier_floor": 0.77,
      "potential_multiplier_ceiling": 1.4
    },
    "design_note": "无锡/苏州以苏南制造业商务和上海、南京、杭州挤压下的补充需求为主，第一版按苏南硕放 3 槽位单机场经营。"
  },
  "component_mix": {
    "business_base_share_pct": 36.0,
    "leisure_base_share_pct": 28.0,
    "vfr_base_share_pct": 12.0,
    "long_haul_base_share_pct": 7.0,
    "transfer_base_share_pct": 17.0
  },
  "component_biases": {
    "business_share_bias": 1.14,
    "leisure_share_bias": 0.88,
    "vfr_share_bias": 0.94,
    "long_haul_share_bias": 0.94,
    "transfer_share_bias": 1.0
  },
  "airline_supply_model": {
    "dynamics_profile_id": "secondary_gateway_selective_v2",
    "dynamics_modifier_ids": [],
    "base_airline_supply_passengers_million": 13.2,
    "regional_airline_capacity_growth_capture": 0.28,
    "annual_local_airline_supply_growth_pct": 0.22,
    "max_local_airline_supply_growth_pct": 16.0,
    "airline_supply_confidence_bias": 0.97,
    "airline_supply_appetite_bias": 1.0,
    "airline_supply_constraint_bias": 1.03
  },
  "commercial_biases": {
    "premium_propensity_bias": 1.08,
    "premium_share_bias": 1.1,
    "duty_free_bias": 1.0,
    "luxury_retail_bias": 1.04,
    "electronics_retail_bias": 1.08,
    "food_beverage_bias": 1.0,
    "general_retail_bias": 1.0
  },
  "facility_model": {
    "airport_facility_slot_profile_id": "wuxi_sunan_primary_single_3_slot_v1",
    "facility_size_catalog": "standard_terminal_sizes_v1",
    "airport_capacity_shortage_policy": "proportional_compression",
    "use_design_capacity_for_crowding": true,
    "use_max_capacity_for_hard_limit": true
  },
  "airports": [
    {
      "airport_id": "WUX",
      "airport_name": "苏南硕放",
      "airport_role": "sunan_manufacturing_secondary_gateway",
      "slot_count": 3,
      "slots": [
        {"slot_id": "WUX_SLOT_1", "slot_name": "T2 主体", "slot_role": "auxiliary_slot", "facility_size": "medium", "open_year": 2025},
        {"slot_id": "WUX_SLOT_2", "slot_name": "T1/区域航站组合", "slot_role": "auxiliary_slot", "facility_size": "small", "open_year": 2025},
        {"slot_id": "WUX_SLOT_3", "slot_name": "硕放玩家改造槽位", "slot_role": "auxiliary_slot", "facility_size": "empty", "open_year": 2025}
      ]
    }
  ],
  "capacity_reference_profiles": [
    {
      "profile_id": "initial_2025",
      "profile_name": "当前初始配置",
      "design_capacity_million": 24.0,
      "max_capacity_million": 36.0,
      "slot_assignments": {"WUX_SLOT_1": "medium", "WUX_SLOT_2": "small", "WUX_SLOT_3": "empty"}
    }
  ],
  "future_airport_options": []
}
