{
  "schema_version": "city-airport-market-config-v1",
  "config_version": "harbin-airport-system-v2",
  "market": {
    "city_airport_market_id": "harbin_airport_system",
    "city_name": "哈尔滨",
    "region_id": "china_mainland",
    "region_name": "中国大陆",
    "market_tier": "regional_gateway",
    "market_type": "primary_single_airport",
    "airport_system": "太平"
  },
  "upstream_linkage": {
    "regional_aviation_demand_region_id": "china_mainland",
    "regional_air_capacity_supply_region_id": "china_mainland",
    "seed_mode": "inherit",
    "branch_mode": "inherit",
    "passenger_components": ["business", "leisure", "vfr", "long_haul", "transfer"]
  },
  "demand_model": {
    "baseline_year": 2025,
    "baseline_region_demand_share_pct": 2.0,
    "baseline_city_potential_passengers_million": 16.2,
    "annual_long_term_city_growth_bias_pct": 0.54,
    "max_long_term_city_growth_bias_pct": 32.0,
    "target_long_term_potential_range_million": [45.0, 85.0],
    "seed_potential_model": {
      "enabled": true,
      "template_id": "china_northeast_recovery_secondary_seed_potential_v1",
      "release_start_year_index": 4.0,
      "full_effect_year_index": 29.0,
      "annual_growth_bias_range_pct": [-0.46, 0.68],
      "max_growth_bias_range_pct": [-22.0, 36.0],
      "regional_correlation_weight": 0.31,
      "potential_multiplier_floor": 0.78,
      "potential_multiplier_ceiling": 1.36
    },
    "design_note": "哈尔滨以东北北部门户、冰雪旅游和俄远东连接为主，第一版按太平 4 槽位单机场经营。"
  },
  "component_mix": {
    "business_base_share_pct": 24.0,
    "leisure_base_share_pct": 40.0,
    "vfr_base_share_pct": 13.0,
    "long_haul_base_share_pct": 7.0,
    "transfer_base_share_pct": 16.0
  },
  "component_biases": {
    "business_share_bias": 0.94,
    "leisure_share_bias": 1.12,
    "vfr_share_bias": 1.02,
    "long_haul_share_bias": 1.0,
    "transfer_share_bias": 1.0
  },
  "airline_supply_model": {
    "dynamics_profile_id": "regional_gateway_following_v2",
    "dynamics_modifier_ids": [],
    "base_airline_supply_passengers_million": 17.2,
    "regional_airline_capacity_growth_capture": 0.28,
    "annual_local_airline_supply_growth_pct": 0.22,
    "max_local_airline_supply_growth_pct": 16.0,
    "airline_supply_confidence_bias": 0.96,
    "airline_supply_appetite_bias": 0.99,
    "airline_supply_constraint_bias": 1.03
  },
  "commercial_biases": {
    "premium_propensity_bias": 1.0,
    "premium_share_bias": 1.0,
    "duty_free_bias": 1.0,
    "luxury_retail_bias": 1.0,
    "electronics_retail_bias": 1.0,
    "food_beverage_bias": 1.04,
    "general_retail_bias": 1.01
  },
  "facility_model": {
    "airport_facility_slot_profile_id": "harbin_primary_single_4_slot_v1",
    "facility_size_catalog": "standard_terminal_sizes_v1",
    "airport_capacity_shortage_policy": "proportional_compression",
    "use_design_capacity_for_crowding": true,
    "use_max_capacity_for_hard_limit": true
  },
  "airports": [
    {
      "airport_id": "HRB",
      "airport_name": "哈尔滨太平",
      "airport_role": "primary_northeast_north_gateway",
      "slot_count": 4,
      "slots": [
        {"slot_id": "HRB_SLOT_1", "slot_name": "T2 主体", "slot_role": "secondary_slot", "facility_size": "large", "open_year": 2025},
        {"slot_id": "HRB_SLOT_2", "slot_name": "T1/区域航站组合", "slot_role": "auxiliary_slot", "facility_size": "small", "open_year": 2025},
        {"slot_id": "HRB_SLOT_3", "slot_name": "太平玩家扩建槽位 1", "slot_role": "auxiliary_slot", "facility_size": "empty", "open_year": 2025},
        {"slot_id": "HRB_SLOT_4", "slot_name": "太平玩家扩建槽位 2", "slot_role": "auxiliary_slot", "facility_size": "empty", "open_year": 2025}
      ]
    }
  ],
  "capacity_reference_profiles": [
    {
      "profile_id": "initial_2025",
      "profile_name": "当前初始配置",
      "design_capacity_million": 40.0,
      "max_capacity_million": 57.0,
      "slot_assignments": {"HRB_SLOT_1": "large", "HRB_SLOT_2": "small", "HRB_SLOT_3": "empty", "HRB_SLOT_4": "empty"}
    }
  ],
  "future_airport_options": []
}
