{
  "schema_version": "city-airport-market-config-v1",
  "config_version": "xiamen-airport-system-v2",
  "market": {
    "city_airport_market_id": "xiamen_airport_system",
    "city_name": "厦门",
    "region_id": "china_mainland",
    "region_name": "中国大陆",
    "market_tier": "regional_gateway",
    "market_type": "replacement_new_single_airport",
    "airport_system": "翔安"
  },
  "upstream_linkage": {
    "regional_aviation_demand_region_id": "china_mainland",
    "regional_air_capacity_supply_region_id": "china_mainland",
    "seed_mode": "inherit",
    "branch_mode": "inherit",
    "passenger_components": [
      "business",
      "leisure",
      "vfr",
      "long_haul",
      "transfer"
    ]
  },
  "demand_model": {
    "baseline_year": 2025,
    "baseline_region_demand_share_pct": 3.9,
    "baseline_city_potential_passengers_million": 32.0,
    "annual_long_term_city_growth_bias_pct": 0.66,
    "max_long_term_city_growth_bias_pct": 40.0,
    "target_long_term_potential_range_million": [
      95.0,
      145.0
    ],
    "seed_potential_model": {
      "enabled": true,
      "template_id": "china_fujian_dual_core_seed_potential_v1",
      "release_start_year_index": 4.0,
      "full_effect_year_index": 28.0,
      "annual_growth_bias_range_pct": [
        -0.42,
        0.62
      ],
      "max_growth_bias_range_pct": [
        -18.0,
        32.0
      ],
      "regional_correlation_weight": 0.31,
      "potential_multiplier_floor": 0.82,
      "potential_multiplier_ceiling": 1.32
    },
    "design_note": "厦门直接按翔安国际机场作为当前经营对象，表达高崎到翔安的单机场迁建替换，不按双机场处理。"
  },
  "component_mix": {
    "business_base_share_pct": 28.0,
    "leisure_base_share_pct": 40.0,
    "vfr_base_share_pct": 13.0,
    "long_haul_base_share_pct": 8.0,
    "transfer_base_share_pct": 11.0
  },
  "component_biases": {
    "business_share_bias": 1.0,
    "leisure_share_bias": 1.08,
    "vfr_share_bias": 1.04,
    "long_haul_share_bias": 1.0,
    "transfer_share_bias": 0.96
  },
  "airline_supply_model": {
    "dynamics_profile_id": "regional_gateway_following_v2",
    "dynamics_modifier_ids": [
      "tourism_exposure_v1"
    ],
    "base_airline_supply_passengers_million": 34.0,
    "regional_airline_capacity_growth_capture": 0.34,
    "annual_local_airline_supply_growth_pct": 0.27,
    "max_local_airline_supply_growth_pct": 21.0,
    "airline_supply_confidence_bias": 0.99,
    "airline_supply_appetite_bias": 1.02,
    "airline_supply_constraint_bias": 1.0
  },
  "commercial_biases": {
    "premium_propensity_bias": 1.07,
    "premium_share_bias": 1.08,
    "duty_free_bias": 1.05,
    "luxury_retail_bias": 1.05,
    "electronics_retail_bias": 1.03,
    "food_beverage_bias": 1.04,
    "general_retail_bias": 1.01
  },
  "facility_model": {
    "airport_facility_slot_profile_id": "xiamen_xiangan_single_5_slot_v1",
    "facility_size_catalog": "standard_terminal_sizes_v1",
    "airport_capacity_shortage_policy": "proportional_compression",
    "use_design_capacity_for_crowding": true,
    "use_max_capacity_for_hard_limit": true
  },
  "airports": [
    {
      "airport_id": "XMN_XIANGAN",
      "airport_name": "厦门翔安国际机场",
      "airport_role": "replacement_coastal_gateway",
      "slot_count": 5,
      "slots": [
        {
          "slot_id": "XMN_SLOT_1",
          "slot_name": "翔安一期主体",
          "slot_role": "main_slot",
          "facility_size": "giant",
          "open_year": 2025
        },
        {
          "slot_id": "XMN_SLOT_2",
          "slot_name": "翔安次槽位预留",
          "slot_role": "secondary_slot",
          "facility_size": "empty",
          "open_year": 2025
        },
        {
          "slot_id": "XMN_SLOT_3",
          "slot_name": "翔安玩家扩建槽位 1",
          "slot_role": "auxiliary_slot",
          "facility_size": "empty",
          "open_year": 2025
        },
        {
          "slot_id": "XMN_SLOT_4",
          "slot_name": "翔安玩家扩建槽位 2",
          "slot_role": "auxiliary_slot",
          "facility_size": "empty",
          "open_year": 2025
        },
        {
          "slot_id": "XMN_SLOT_5",
          "slot_name": "翔安玩家扩建槽位 3",
          "slot_role": "auxiliary_slot",
          "facility_size": "empty",
          "open_year": 2025
        }
      ]
    }
  ],
  "capacity_reference_profiles": [
    {
      "profile_id": "initial_2025",
      "profile_name": "当前初始配置",
      "design_capacity_million": 72.0,
      "max_capacity_million": 90.0,
      "slot_assignments": {
        "XMN_SLOT_1": "giant",
        "XMN_SLOT_2": "empty",
        "XMN_SLOT_3": "empty",
        "XMN_SLOT_4": "empty",
        "XMN_SLOT_5": "empty"
      }
    }
  ],
  "future_airport_options": []
}
