{
  "schema_version": "city-airport-market-config-v1",
  "config_version": "nanchang-airport-system-v2",
  "market": {
    "city_airport_market_id": "nanchang_airport_system",
    "city_name": "南昌",
    "region_id": "china_mainland",
    "region_name": "中国大陆",
    "market_tier": "secondary_gateway",
    "market_type": "primary_single_airport",
    "airport_system": "昌北"
  },
  "upstream_linkage": {
    "regional_aviation_demand_region_id": "china_mainland",
    "regional_air_capacity_supply_region_id": "china_mainland",
    "seed_mode": "inherit",
    "branch_mode": "inherit",
    "passenger_components": ["business", "leisure", "vfr", "long_haul", "transfer"]
  },
  "demand_model": {
    "baseline_year": 2025,
    "baseline_region_demand_share_pct": 1.65,
    "baseline_city_potential_passengers_million": 13.5,
    "annual_long_term_city_growth_bias_pct": 0.52,
    "max_long_term_city_growth_bias_pct": 30.0,
    "target_long_term_potential_range_million": [38.0, 70.0],
    "seed_potential_model": {
      "enabled": true,
      "template_id": "china_regular_provincial_catchup_seed_potential_v1",
      "release_start_year_index": 4.0,
      "full_effect_year_index": 29.0,
      "annual_growth_bias_range_pct": [-0.46, 0.66],
      "max_growth_bias_range_pct": [-22.0, 34.0],
      "regional_correlation_weight": 0.3,
      "potential_multiplier_floor": 0.78,
      "potential_multiplier_ceiling": 1.34
    },
    "design_note": "南昌以江西省会、区域商务、探亲和内陆旅游为主，第一版按昌北 3 槽位单机场经营。"
  },
  "component_mix": {
    "business_base_share_pct": 27.0,
    "leisure_base_share_pct": 35.0,
    "vfr_base_share_pct": 14.0,
    "long_haul_base_share_pct": 5.0,
    "transfer_base_share_pct": 19.0
  },
  "component_biases": {
    "business_share_bias": 0.99,
    "leisure_share_bias": 1.0,
    "vfr_share_bias": 1.02,
    "long_haul_share_bias": 0.84,
    "transfer_share_bias": 1.04
  },
  "airline_supply_model": {
    "dynamics_profile_id": "secondary_gateway_selective_v2",
    "dynamics_modifier_ids": [],
    "base_airline_supply_passengers_million": 14.3,
    "regional_airline_capacity_growth_capture": 0.29,
    "annual_local_airline_supply_growth_pct": 0.22,
    "max_local_airline_supply_growth_pct": 16.0,
    "airline_supply_confidence_bias": 0.96,
    "airline_supply_appetite_bias": 0.98,
    "airline_supply_constraint_bias": 1.03
  },
  "commercial_biases": {
    "premium_propensity_bias": 0.99,
    "premium_share_bias": 0.99,
    "duty_free_bias": 0.98,
    "luxury_retail_bias": 0.98,
    "electronics_retail_bias": 1.0,
    "food_beverage_bias": 1.01,
    "general_retail_bias": 1.0
  },
  "facility_model": {
    "airport_facility_slot_profile_id": "nanchang_primary_single_3_slot_v1",
    "facility_size_catalog": "standard_terminal_sizes_v1",
    "airport_capacity_shortage_policy": "proportional_compression",
    "use_design_capacity_for_crowding": true,
    "use_max_capacity_for_hard_limit": true
  },
  "airports": [
    {
      "airport_id": "KHN",
      "airport_name": "南昌昌北",
      "airport_role": "primary_jiangxi_gateway",
      "slot_count": 3,
      "slots": [
        {"slot_id": "KHN_SLOT_1", "slot_name": "T2 主体", "slot_role": "auxiliary_slot", "facility_size": "medium", "open_year": 2025},
        {"slot_id": "KHN_SLOT_2", "slot_name": "T1/区域航站组合", "slot_role": "auxiliary_slot", "facility_size": "small", "open_year": 2025},
        {"slot_id": "KHN_SLOT_3", "slot_name": "昌北玩家改造槽位", "slot_role": "auxiliary_slot", "facility_size": "empty", "open_year": 2025}
      ]
    }
  ],
  "capacity_reference_profiles": [
    {
      "profile_id": "initial_2025",
      "profile_name": "当前初始配置",
      "design_capacity_million": 24.0,
      "max_capacity_million": 36.0,
      "slot_assignments": {"KHN_SLOT_1": "medium", "KHN_SLOT_2": "small", "KHN_SLOT_3": "empty"}
    }
  ],
  "future_airport_options": []
}
