{
  "schema_version": "city-airport-market-config-v1",
  "config_version": "urumqi-airport-system-v2",
  "market": {
    "city_airport_market_id": "urumqi_airport_system",
    "city_name": "乌鲁木齐",
    "region_id": "china_mainland",
    "region_name": "中国大陆",
    "market_tier": "strategic_gateway",
    "market_type": "primary_single_airport",
    "airport_system": "地窝堡"
  },
  "upstream_linkage": {
    "regional_aviation_demand_region_id": "china_mainland",
    "regional_air_capacity_supply_region_id": "china_mainland",
    "seed_mode": "inherit",
    "branch_mode": "inherit",
    "passenger_components": ["business", "leisure", "vfr", "long_haul", "transfer"]
  },
  "demand_model": {
    "baseline_year": 2025,
    "baseline_region_demand_share_pct": 3.4,
    "baseline_city_potential_passengers_million": 28.0,
    "annual_long_term_city_growth_bias_pct": 0.62,
    "max_long_term_city_growth_bias_pct": 38.0,
    "target_long_term_potential_range_million": [85.0, 150.0],
    "seed_potential_model": {
      "enabled": true,
      "template_id": "china_northwest_strategic_gateway_seed_potential_v1",
      "release_start_year_index": 4.0,
      "full_effect_year_index": 28.0,
      "annual_growth_bias_range_pct": [-0.38, 0.6],
      "max_growth_bias_range_pct": [-18.0, 32.0],
      "regional_correlation_weight": 0.32,
      "potential_multiplier_floor": 0.82,
      "potential_multiplier_ceiling": 1.32
    },
    "design_note": "乌鲁木齐以西北远程门户、边疆连接、长航线和战略航空网络为主，保留 5 槽位单机场经营空间。"
  },
  "component_mix": {
    "business_base_share_pct": 25.0,
    "leisure_base_share_pct": 34.0,
    "vfr_base_share_pct": 10.0,
    "long_haul_base_share_pct": 15.0,
    "transfer_base_share_pct": 16.0
  },
  "component_biases": {
    "business_share_bias": 0.96,
    "leisure_share_bias": 1.0,
    "vfr_share_bias": 0.94,
    "long_haul_share_bias": 1.18,
    "transfer_share_bias": 1.02
  },
  "airline_supply_model": {
    "dynamics_profile_id": "regional_gateway_following_v2",
    "dynamics_modifier_ids": [
      "strategic_support_v1"
    ],
    "base_airline_supply_passengers_million": 29.5,
    "regional_airline_capacity_growth_capture": 0.35,
    "annual_local_airline_supply_growth_pct": 0.26,
    "max_local_airline_supply_growth_pct": 19.0,
    "airline_supply_confidence_bias": 0.99,
    "airline_supply_appetite_bias": 1.02,
    "airline_supply_constraint_bias": 1.0
  },
  "commercial_biases": {
    "premium_propensity_bias": 1.04,
    "premium_share_bias": 1.04,
    "duty_free_bias": 1.03,
    "luxury_retail_bias": 1.02,
    "electronics_retail_bias": 1.02,
    "food_beverage_bias": 1.03,
    "general_retail_bias": 1.01
  },
  "facility_model": {
    "airport_facility_slot_profile_id": "urumqi_primary_single_5_slot_v1",
    "facility_size_catalog": "standard_terminal_sizes_v1",
    "airport_capacity_shortage_policy": "proportional_compression",
    "use_design_capacity_for_crowding": true,
    "use_max_capacity_for_hard_limit": true
  },
  "airports": [
    {
      "airport_id": "URC",
      "airport_name": "乌鲁木齐地窝堡",
      "airport_role": "primary_xinjiang_and_central_asia_gateway",
      "slot_count": 5,
      "slots": [
        {"slot_id": "URC_SLOT_1", "slot_name": "T4 主体", "slot_role": "main_slot", "facility_size": "extra_large", "open_year": 2025},
        {"slot_id": "URC_SLOT_2", "slot_name": "T3/卫星厅组合", "slot_role": "secondary_slot", "facility_size": "medium", "open_year": 2025},
        {"slot_id": "URC_SLOT_3", "slot_name": "地窝堡玩家扩建槽位 1", "slot_role": "auxiliary_slot", "facility_size": "empty", "open_year": 2025},
        {"slot_id": "URC_SLOT_4", "slot_name": "地窝堡玩家扩建槽位 2", "slot_role": "auxiliary_slot", "facility_size": "empty", "open_year": 2025},
        {"slot_id": "URC_SLOT_5", "slot_name": "地窝堡玩家扩建槽位 3", "slot_role": "auxiliary_slot", "facility_size": "empty", "open_year": 2025}
      ]
    }
  ],
  "capacity_reference_profiles": [
    {
      "profile_id": "initial_2025",
      "profile_name": "当前初始配置",
      "design_capacity_million": 66.0,
      "max_capacity_million": 89.0,
      "slot_assignments": {"URC_SLOT_1": "extra_large", "URC_SLOT_2": "medium", "URC_SLOT_3": "empty", "URC_SLOT_4": "empty", "URC_SLOT_5": "empty"}
    }
  ],
  "future_airport_options": []
}
