{
  "schema_version": "city-airport-market-config-v1",
  "config_version": "sanya-airport-system-v2",
  "market": {
    "city_airport_market_id": "sanya_airport_system",
    "city_name": "三亚",
    "region_id": "china_mainland",
    "region_name": "中国大陆",
    "market_tier": "tourism_gateway",
    "market_type": "tourism_single_airport",
    "airport_system": "凤凰"
  },
  "upstream_linkage": {
    "regional_aviation_demand_region_id": "china_mainland",
    "regional_air_capacity_supply_region_id": "china_mainland",
    "seed_mode": "inherit",
    "branch_mode": "inherit",
    "passenger_components": ["business", "leisure", "vfr", "long_haul", "transfer"]
  },
  "demand_model": {
    "baseline_year": 2025,
    "baseline_region_demand_share_pct": 2.6,
    "baseline_city_potential_passengers_million": 22.0,
    "annual_long_term_city_growth_bias_pct": 0.6,
    "max_long_term_city_growth_bias_pct": 36.0,
    "target_long_term_potential_range_million": [60.0, 120.0],
    "seed_potential_model": {
      "enabled": true,
      "template_id": "china_hainan_premium_tourism_destination_seed_potential_v1",
      "release_start_year_index": 4.0,
      "full_effect_year_index": 29.0,
      "annual_growth_bias_range_pct": [-0.7, 0.9],
      "max_growth_bias_range_pct": [-32.0, 48.0],
      "regional_correlation_weight": 0.29,
      "potential_multiplier_floor": 0.68,
      "potential_multiplier_ceiling": 1.48
    },
    "design_note": "三亚以强旅游目的地、季节波动和高休闲占比为主，城市规模不按大枢纽处理，第一版按凤凰 3 槽位单机场经营。"
  },
  "component_mix": {
    "business_base_share_pct": 16.0,
    "leisure_base_share_pct": 60.0,
    "vfr_base_share_pct": 5.0,
    "long_haul_base_share_pct": 12.0,
    "transfer_base_share_pct": 7.0
  },
  "component_biases": {
    "business_share_bias": 0.72,
    "leisure_share_bias": 1.32,
    "vfr_share_bias": 0.76,
    "long_haul_share_bias": 1.1,
    "transfer_share_bias": 0.72
  },
  "airline_supply_model": {
    "dynamics_profile_id": "regional_gateway_following_v2",
    "dynamics_modifier_ids": [
      "tourism_exposure_v1"
    ],
    "base_airline_supply_passengers_million": 23.2,
    "regional_airline_capacity_growth_capture": 0.3,
    "annual_local_airline_supply_growth_pct": 0.24,
    "max_local_airline_supply_growth_pct": 18.0,
    "airline_supply_confidence_bias": 0.98,
    "airline_supply_appetite_bias": 1.04,
    "airline_supply_constraint_bias": 1.0
  },
  "commercial_biases": {
    "premium_propensity_bias": 1.14,
    "premium_share_bias": 1.12,
    "duty_free_bias": 1.22,
    "luxury_retail_bias": 1.18,
    "electronics_retail_bias": 1.02,
    "food_beverage_bias": 1.08,
    "general_retail_bias": 1.02
  },
  "facility_model": {
    "airport_facility_slot_profile_id": "sanya_primary_single_3_slot_v1",
    "facility_size_catalog": "standard_terminal_sizes_v1",
    "airport_capacity_shortage_policy": "proportional_compression",
    "use_design_capacity_for_crowding": true,
    "use_max_capacity_for_hard_limit": true
  },
  "airports": [
    {
      "airport_id": "SYX",
      "airport_name": "三亚凤凰",
      "airport_role": "primary_hainan_south_tourism_gateway",
      "slot_count": 3,
      "slots": [
        {"slot_id": "SYX_SLOT_1", "slot_name": "T1/T2 主体", "slot_role": "auxiliary_slot", "facility_size": "large", "open_year": 2025},
        {"slot_id": "SYX_SLOT_2", "slot_name": "国际区/卫星厅组合", "slot_role": "auxiliary_slot", "facility_size": "medium", "open_year": 2025},
        {"slot_id": "SYX_SLOT_3", "slot_name": "凤凰玩家改造槽位", "slot_role": "auxiliary_slot", "facility_size": "empty", "open_year": 2025}
      ]
    }
  ],
  "capacity_reference_profiles": [
    {
      "profile_id": "initial_2025",
      "profile_name": "当前初始配置",
      "design_capacity_million": 48.0,
      "max_capacity_million": 69.0,
      "slot_assignments": {"SYX_SLOT_1": "large", "SYX_SLOT_2": "medium", "SYX_SLOT_3": "empty"}
    }
  ],
  "future_airport_options": []
}
