{
  "schema_version": "city-airport-market-config-v1",
  "config_version": "hangzhou-airport-system-v2",
  "market": {
    "city_airport_market_id": "hangzhou_airport_system",
    "city_name": "杭州",
    "region_id": "china_mainland",
    "region_name": "中国大陆",
    "market_tier": "national_gateway",
    "market_type": "primary_airport_with_future_second_airport",
    "airport_system": "萧山 + 第二机场预留"
  },
  "upstream_linkage": {
    "regional_aviation_demand_region_id": "china_mainland",
    "regional_air_capacity_supply_region_id": "china_mainland",
    "seed_mode": "inherit",
    "branch_mode": "inherit",
    "passenger_components": [
      "business",
      "leisure",
      "vfr",
      "long_haul",
      "transfer"
    ]
  },
  "demand_model": {
    "baseline_year": 2025,
    "baseline_region_demand_share_pct": 7.2,
    "baseline_city_potential_passengers_million": 60.0,
    "annual_long_term_city_growth_bias_pct": 0.72,
    "max_long_term_city_growth_bias_pct": 44.0,
    "target_long_term_potential_range_million": [
      175.0,
      250.0
    ],
    "seed_potential_model": {
      "enabled": true,
      "template_id": "china_yangtze_delta_secondary_gateway_seed_potential_v1",
      "release_start_year_index": 4.0,
      "full_effect_year_index": 27.0,
      "annual_growth_bias_range_pct": [
        -0.35,
        0.5
      ],
      "max_growth_bias_range_pct": [
        -16.0,
        26.0
      ],
      "regional_correlation_weight": 0.32,
      "potential_multiplier_floor": 0.84,
      "potential_multiplier_ceiling": 1.27
    },
    "design_note": "杭州以长三角南翼、数字经济商务、休闲旅游和上海外溢连接为主，远期由第二机场释放单机场触顶压力。"
  },
  "component_mix": {
    "business_base_share_pct": 30.0,
    "leisure_base_share_pct": 39.0,
    "vfr_base_share_pct": 10.0,
    "long_haul_base_share_pct": 9.0,
    "transfer_base_share_pct": 12.0
  },
  "component_biases": {
    "business_share_bias": 1.04,
    "leisure_share_bias": 1.04,
    "vfr_share_bias": 0.94,
    "long_haul_share_bias": 1.02,
    "transfer_share_bias": 1.06
  },
  "airline_supply_model": {
    "dynamics_profile_id": "national_gateway_competitive_v2",
    "dynamics_modifier_ids": [],
    "base_airline_supply_passengers_million": 62.0,
    "regional_airline_capacity_growth_capture": 0.4,
    "annual_local_airline_supply_growth_pct": 0.3,
    "max_local_airline_supply_growth_pct": 23.0,
    "airline_supply_confidence_bias": 1.0,
    "airline_supply_appetite_bias": 1.03,
    "airline_supply_constraint_bias": 0.99
  },
  "commercial_biases": {
    "premium_propensity_bias": 1.12,
    "premium_share_bias": 1.14,
    "duty_free_bias": 1.05,
    "luxury_retail_bias": 1.08,
    "electronics_retail_bias": 1.12,
    "food_beverage_bias": 1.02,
    "general_retail_bias": 1.0
  },
  "facility_model": {
    "airport_facility_slot_profile_id": "hangzhou_primary_future_5_slot_v1",
    "facility_size_catalog": "standard_terminal_sizes_v1",
    "airport_capacity_shortage_policy": "proportional_compression",
    "use_design_capacity_for_crowding": true,
    "use_max_capacity_for_hard_limit": true
  },
  "airports": [
    {
      "airport_id": "HGH",
      "airport_name": "杭州萧山",
      "airport_role": "primary_yangtze_delta_south_gateway",
      "slot_count": 5,
      "slots": [
        {
          "slot_id": "HGH_SLOT_1",
          "slot_name": "T4 主体",
          "slot_role": "main_slot",
          "facility_size": "extra_large",
          "allowed_sizes": [
            "empty",
            "small",
            "medium",
            "large",
            "extra_large",
            "giant"
          ],
          "open_year": 2025
        },
        {
          "slot_id": "HGH_SLOT_2",
          "slot_name": "T3/T1/卫星厅组合",
          "slot_role": "secondary_slot",
          "facility_size": "large",
          "allowed_sizes": [
            "empty",
            "small",
            "medium",
            "large",
            "extra_large"
          ],
          "open_year": 2025
        },
        {
          "slot_id": "HGH_SLOT_3",
          "slot_name": "萧山玩家扩建槽位 1",
          "slot_role": "auxiliary_slot",
          "facility_size": "empty",
          "allowed_sizes": [
            "empty",
            "small",
            "medium",
            "large"
          ],
          "open_year": 2025
        },
        {
          "slot_id": "HGH_SLOT_4",
          "slot_name": "萧山玩家扩建槽位 2",
          "slot_role": "auxiliary_slot",
          "facility_size": "empty",
          "allowed_sizes": [
            "empty",
            "small",
            "medium",
            "large"
          ],
          "open_year": 2025
        },
        {
          "slot_id": "HGH_SLOT_5",
          "slot_name": "萧山玩家扩建槽位 3",
          "slot_role": "auxiliary_slot",
          "facility_size": "empty",
          "allowed_sizes": [
            "empty",
            "small",
            "medium",
            "large"
          ],
          "open_year": 2025
        }
      ]
    }
  ],
  "capacity_reference_profiles": [
    {
      "profile_id": "initial_2025",
      "profile_name": "当前初始配置",
      "design_capacity_million": 82.0,
      "max_capacity_million": 110.0,
      "slot_assignments": {
        "HGH_SLOT_1": "extra_large",
        "HGH_SLOT_2": "large",
        "HGH_SLOT_3": "empty",
        "HGH_SLOT_4": "empty",
        "HGH_SLOT_5": "empty"
      }
    }
  ],
  "future_airport_options": [
    {
      "airport_id": "HGH_SECOND",
      "airport_name": "杭州第二机场（湖州德清方向）",
      "name_policy": "planned_direction_until_official_name_exists",
      "default_slot_count": 5,
      "default_slot_role_template": [
        "main_slot",
        "secondary_slot",
        "auxiliary_slot",
        "auxiliary_slot",
        "auxiliary_slot"
      ],
      "starting_main_slot_allowed_sizes": [
        "medium",
        "large",
        "extra_large",
        "giant"
      ],
      "design_note": "作为杭州都市圈和长三角南翼外溢供给的未来选项，建成后按标准 5 槽位机场配置。"
    }
  ]
}
