{
  "schema_version": "city-airport-market-config-v1",
  "config_version": "haikou-airport-system-v2",
  "market": {
    "city_airport_market_id": "haikou_airport_system",
    "city_name": "海口",
    "region_id": "china_mainland",
    "region_name": "中国大陆",
    "market_tier": "regional_gateway",
    "market_type": "island_primary_single_airport",
    "airport_system": "美兰"
  },
  "upstream_linkage": {
    "regional_aviation_demand_region_id": "china_mainland",
    "regional_air_capacity_supply_region_id": "china_mainland",
    "seed_mode": "inherit",
    "branch_mode": "inherit",
    "passenger_components": ["business", "leisure", "vfr", "long_haul", "transfer"]
  },
  "demand_model": {
    "baseline_year": 2025,
    "baseline_region_demand_share_pct": 2.9,
    "baseline_city_potential_passengers_million": 24.0,
    "annual_long_term_city_growth_bias_pct": 0.62,
    "max_long_term_city_growth_bias_pct": 38.0,
    "target_long_term_potential_range_million": [70.0, 130.0],
    "seed_potential_model": {
      "enabled": true,
      "template_id": "china_hainan_island_primary_gateway_seed_potential_v1",
      "release_start_year_index": 4.0,
      "full_effect_year_index": 28.0,
      "annual_growth_bias_range_pct": [-0.38, 0.62],
      "max_growth_bias_range_pct": [-18.0, 32.0],
      "regional_correlation_weight": 0.32,
      "potential_multiplier_floor": 0.82,
      "potential_multiplier_ceiling": 1.32
    },
    "design_note": "海口以海南北部门户、岛内双核心和免税/旅游入口为主，第一版按美兰 4 槽位单机场经营。"
  },
  "component_mix": {
    "business_base_share_pct": 24.0,
    "leisure_base_share_pct": 45.0,
    "vfr_base_share_pct": 10.0,
    "long_haul_base_share_pct": 8.0,
    "transfer_base_share_pct": 13.0
  },
  "component_biases": {
    "business_share_bias": 0.9,
    "leisure_share_bias": 1.16,
    "vfr_share_bias": 0.94,
    "long_haul_share_bias": 1.02,
    "transfer_share_bias": 0.96
  },
  "airline_supply_model": {
    "dynamics_profile_id": "regional_gateway_following_v2",
    "dynamics_modifier_ids": [
      "tourism_exposure_v1"
    ],
    "base_airline_supply_passengers_million": 25.5,
    "regional_airline_capacity_growth_capture": 0.33,
    "annual_local_airline_supply_growth_pct": 0.25,
    "max_local_airline_supply_growth_pct": 19.0,
    "airline_supply_confidence_bias": 0.99,
    "airline_supply_appetite_bias": 1.03,
    "airline_supply_constraint_bias": 0.99
  },
  "commercial_biases": {
    "premium_propensity_bias": 1.08,
    "premium_share_bias": 1.1,
    "duty_free_bias": 1.16,
    "luxury_retail_bias": 1.12,
    "electronics_retail_bias": 1.04,
    "food_beverage_bias": 1.05,
    "general_retail_bias": 1.02
  },
  "facility_model": {
    "airport_facility_slot_profile_id": "haikou_primary_single_4_slot_v1",
    "facility_size_catalog": "standard_terminal_sizes_v1",
    "airport_capacity_shortage_policy": "proportional_compression",
    "use_design_capacity_for_crowding": true,
    "use_max_capacity_for_hard_limit": true
  },
  "airports": [
    {
      "airport_id": "HAK",
      "airport_name": "海口美兰",
      "airport_role": "primary_hainan_north_gateway",
      "slot_count": 4,
      "slots": [
        {"slot_id": "HAK_SLOT_1", "slot_name": "T2 主体", "slot_role": "secondary_slot", "facility_size": "large", "open_year": 2025},
        {"slot_id": "HAK_SLOT_2", "slot_name": "T1/国际区组合", "slot_role": "auxiliary_slot", "facility_size": "medium", "open_year": 2025},
        {"slot_id": "HAK_SLOT_3", "slot_name": "美兰玩家扩建槽位 1", "slot_role": "auxiliary_slot", "facility_size": "empty", "open_year": 2025},
        {"slot_id": "HAK_SLOT_4", "slot_name": "美兰玩家扩建槽位 2", "slot_role": "auxiliary_slot", "facility_size": "empty", "open_year": 2025}
      ]
    }
  ],
  "capacity_reference_profiles": [
    {
      "profile_id": "initial_2025",
      "profile_name": "当前初始配置",
      "design_capacity_million": 48.0,
      "max_capacity_million": 69.0,
      "slot_assignments": {"HAK_SLOT_1": "large", "HAK_SLOT_2": "medium", "HAK_SLOT_3": "empty", "HAK_SLOT_4": "empty"}
    }
  ],
  "future_airport_options": []
}
